{
  "schema": "urn:algaguard:schema:onboarding:bootstrap-token-exchange-response:v1",
  "schemaVersion": "1.0.0",
  "bootstrapSessionId": "33333333-3333-4333-8333-333333333333",
  "deviceUuid": "aaaaaaaa-aaaa-4aaa-8aaa-aaaaaaaaaaaa",
  "deviceId": "AG-000001",
  "bootstrapToken": "bootstrap-token-placeholder-only-4xYz9AbCdEfGhIjKlMnOpQrStUvWx",
  "expiresAt": "2026-07-24T00:05:00Z",
  "contractVersion": "1.0.0"
}
